"Building a custom HTML5 video player with CSS3 and jQuery",http://dev.opera.com/articles/view/custom-html5-video-player-with-css3-and-jquery/,http://dev.opera.com/articles/view/custom-html5-video-player-with-css3-and-jquery/,"Tue 03 Aug 2010 7:31:42 EDT","We will look at building up an easily customizable HTML5 video player including packaging it as a simple jQuery plugin choosing control types and outputting custom CSS for your own situation.<br /><span style=""font-size:12px;"">via: <a href=""http://dev.opera.com/articles/view/custom-html5-video-player-with-css3-and-jquery/"" rel=""nofollow"" >dev.opera.com</a></span><br /><br /><br />"
"Implement the Google AJAX Search API - David Walsh Blog",http://davidwalsh.name/google-ajax-search,http://davidwalsh.name/google-ajax-search,"Tue 03 Aug 2010 7:34:41 EDT","Luckily for us Google provides an awesome method by which we can use their search for our own site: the Google AJAX Search API. Let me show you how to implement this awesome API within your own website!<br /><span style=""font-size:12px;"">via: <a href=""http://davidwalsh.name/google-ajax-search"" rel=""nofollow"" >davidwalsh.name</a></span><br /><br /><br />"
"jQuery quickie Slot machine style navigation",http://www.marcofolio.net/webdesign/jquery_quickie_slot_machine_navigation.html,http://www.marcofolio.net/webdesign/jquery_quickie_slot_machine_navigation.html,"Tue 03 Aug 2010 7:44:39 EDT","We will be creating a slot machine style navigation coded with jQuery that you could use on your website.<br /><span style=""font-size:12px;"">via: <a href=""http://www.marcofolio.net/webdesign/jquery_quickie_slot_machine_navigation.html"" rel=""nofollow"" >marcofolio.net</a></span><br /><br /><br />"
"8 Steps to Enhance the Usability of an eCommerce Website",http://ecommerce.pixelcrayons.com/knowledge-base/8-steps-to-enhance-the-usability-of-an-ecommerce-website/,http://ecommerce.pixelcrayons.com/knowledge-base/8-steps-to-enhance-the-usability-of-an-ecommerce-website/,"Tue 03 Aug 2010 7:53:40 EDT","Reviews 8 Steps to Enhance the Usability of an eCommerce Website.<br /><span style=""font-size:12px;"">via: <a href=""http://ecommerce.pixelcrayons.com/knowledge-base/8-steps-to-enhance-the-usability-of-an-ecommerce-website/"" rel=""nofollow"" >ecommerce.pixelcrayons.com</a></span><br /><br /><br />"
"3 Essential Elements of a Client-Grabbing Design Website",http://graphicdesignblender.com/3-essential-elements-of-a-client-grabbing-design-website,http://graphicdesignblender.com/3-essential-elements-of-a-client-grabbing-design-website,"Wed 04 Aug 2010 6:26:22 EDT","This article will help get you on track to having a web site that serves as an automated-client-grabbing machine.<br /><span style=""font-size:12px;"">via: <a href=""http://graphicdesignblender.com/3-essential-elements-of-a-client-grabbing-design-website"" rel=""nofollow"" >graphicdesignblender.com</a></span><br /><br /><br />"
"Designers - show your creative portfolio on LinkedIn with Behance",http://designyoutrust.com/2010/08/05/creative-portfolio-display-a-one-stop-solution-for-showcasing-your-work-online/,http://designyoutrust.com/2010/08/05/creative-portfolio-display-a-one-stop-solution-for-showcasing-your-work-online/,"Thu 05 Aug 2010 8:02:31 EDT","Now you can showcase your creative portfolio on your LinkedIn profile by installing a simple application created by Behance.<br /><span style=""font-size:12px;"">via: <a href=""http://designyoutrust.com/2010/08/05/creative-portfolio-display-a-one-stop-solution-for-showcasing-your-work-online/"" rel=""nofollow"" >designyoutrust.com</a></span><br /><br /><br />"
"50 Ultimate Useful Free Wordpress Plugins",http://www.multyshades.com/2010/08/50-ultimate-useful-free-wordpress-plugins-widgets/,http://www.multyshades.com/2010/08/50-ultimate-useful-free-wordpress-plugins-widgets/,"Thu 05 Aug 2010 8:10:34 EDT","We have been searching for some of the best free WordPress plugins and widgets available on the web and here are 50 of the best.<br /><span style=""font-size:12px;"">via: <a href=""http://www.multyshades.com/2010/08/50-ultimate-useful-free-wordpress-plugins-widgets/"" rel=""nofollow"" >multyshades.com</a></span><br /><br /><br />"
"A Study of Photographic Website Backgrounds",http://psdfan.com/inspiration/web-design/a-study-of-photographic-website-backgrounds/,http://psdfan.com/inspiration/web-design/a-study-of-photographic-website-backgrounds/,"Thu 05 Aug 2010 8:13:52 EDT","Today we look at the use of photographic website backgrounds and how it seems to be becoming a popular design trend. We weigh up the pros and cons of this technique and look at some inspiring examples.<br /><span style=""font-size:12px;"">via: <a href=""http://psdfan.com/inspiration/web-design/a-study-of-photographic-website-backgrounds/"" rel=""nofollow"" >psdfan.com</a></span><br /><br /><br />"
"15 Most Beautiful Minimal And Clean Tumblr Themes",http://resources.savedelete.com/15-most-beautiful-minimal-and-clean-tumblr-themes.html,http://resources.savedelete.com/15-most-beautiful-minimal-and-clean-tumblr-themes.html,"Thu 05 Aug 2010 8:32:18 EDT","Today we are providing 15 most beautiful minimal and clean tumblr themes which can help to design beautiful and minimal blog  and portfolio.<br /><span style=""font-size:12px;"">via: <a href=""http://resources.savedelete.com/15-most-beautiful-minimal-and-clean-tumblr-themes.html"" rel=""nofollow"" >resources.savedelete.com</a></span><br /><br /><br />"
"30 Awesome Wordpress Plugins for Creating Galleries and Slideshows",http://www.tripwiremagazine.com/2010/08/30-awesome-wordpress-plugins-for-galleries-and-slideshows.html,http://www.tripwiremagazine.com/2010/08/30-awesome-wordpress-plugins-for-galleries-and-slideshows.html,"Fri 06 Aug 2010 7:11:51 EDT","I have compiled a list of the best WordPress Gallery Slideshow plugins<br /><span style=""font-size:12px;"">via: <a href=""http://www.tripwiremagazine.com/2010/08/30-awesome-wordpress-plugins-for-galleries-and-slideshows.html"" rel=""nofollow"" >tripwiremagazine.com</a></span><br /><br /><br />"
"Convert HTML to PDF Online HTML to PDF API",http://pdfcrowd.com/,http://pdfcrowd.com/,"Fri 06 Aug 2010 7:35:30 EDT","Create PDF from web pages or raw HTML code<br /><span style=""font-size:12px;"">via: <a href=""http://pdfcrowd.com/"" rel=""nofollow"" >pdfcrowd.com</a></span><br /><br /><br />"
"The Ultimate Roundup of 55 CSS3 Tutorials",http://www.1stwebdesigner.com/resources/css3-tutorials/,http://www.1stwebdesigner.com/resources/css3-tutorials/,"Mon 09 Aug 2010 7:52:14 EDT","In this collection you will find 57 High Quality CSS3 Tutorials that help to stand out from the crowd and make better designs using only CSS.<br /><span style=""font-size:12px;"">via: <a href=""http://www.1stwebdesigner.com/resources/css3-tutorials/"" rel=""nofollow"" >1stwebdesigner.com</a></span><br /><br /><br />"
"5 Quality UX Blogs Designers Should Read",http://www.acuitydesigns.net/5-quality-ux-blogs-designers-should-read/,http://www.acuitydesigns.net/5-quality-ux-blogs-designers-should-read/,"Mon 09 Aug 2010 7:54:59 EDT","It makes sense to stay up to date and informed on recent developments assertions and techniques in relation to User Experience. Here are 5 UX blogs designers should read.<br /><span style=""font-size:12px;"">via: <a href=""http://www.acuitydesigns.net/5-quality-ux-blogs-designers-should-read/"" rel=""nofollow"" >acuitydesigns.net</a></span><br /><br /><br />"
